<?xml version="1.0" encoding="utf-8" ?>
<!DOCTYPE renderer SYSTEM "hypernumbers.dtd">
<renderer>
  <bindings>
    <binding identity="someid1" source="a1"    rendertype="static"/>
    <binding identity="someid2" source="b1"    rendertype="dynamic"/>
    <binding identity="someid3" source="a2"    rendertype="both"/>
    <binding identity="someid4" source="d3:d6" rendertype="both"/>
  </bindings>
  <body>
    <div id="someid1" class="classname1">
      <div>
        <span id="someid2" class = "classname2"></span>
        <span class="classname3"></span>
        <div id="someid3" class="classname4"></div>
        <div id="someid4"></div>
        <table>
          <tr><td></td></tr>
        </table>
      </div>
    </div>
  </body>
</renderer>